{
  "schema": "arena.job/1",
  "id": "JOB-20260829-1f4f73",
  "title": "DEMO — فحص معمل الاختبار",
  "target": {
    "value": "http://localhost:8090",
    "kind": "url",
    "authorized": true
  },
  "actions": [
    "passive",
    "sast",
    "active",
    "exploit-validation"
  ],
  "mode": "full",
  "priority": "P2",
  "state": "queued",
  "created_at": "2026-08-29T19:52:28.336Z",
  "updated_at": "2026-08-29T19:52:28.337Z",
  "requested_by": "n8n",
  "notify_url": null,
  "context": {},
  "lease": null,
  "result": null
}
