{
  "schema": "arena.job/1",
  "id": "JOB-20260829-1f4f73-R0000",
  "title": "retest: DEMO — فحص معمل الاختبار (10 findings)",
  "target": {
    "value": "http://localhost:8090",
    "kind": "url",
    "authorized": true
  },
  "actions": [
    "passive",
    "sast",
    "active",
    "exploit-validation"
  ],
  "mode": "retest",
  "priority": "P2",
  "state": "queued",
  "created_at": "2026-08-29T19:59:20.002Z",
  "updated_at": "2026-08-29T19:59:20.002Z",
  "requested_by": "n8n",
  "notify_url": null,
  "context": {
    "instructions": "- critical نقطة نهاية تصحيحية مكشوفة تُرجع كل كلمات المرور بوضوح\n  verify: curl -sS http://localhost:8090/api/debug  →  200 OK بلا أي توكن الاستجابة تتضمن users[].password=[REDACTED]\n- high BOLA/IDOR في /api/orders/:id — أي مستخدم يقرأ طلبات الآخرين مع أرقام البطاقات\n  verify: POST /api/login بحساب sara@lab.test → توكن (sub=2, role=customer) GET /api/orders/1002 بنفس التوكن → 200 مع بيانات مستخدم آخر المقارنة: الطلب 1002 يملكه user_id=1 ≠ 2\n- high Mass assignment في POST /api/users/me يسمح بترقية الدور إلى admin\n  verify: POST /api/users/me بـ {\"role\":\"admin\"} مع توكن sara الاستجابة تعيد role: admin التحقق: GET /api/debug يُظهر sara role=admin يمكن كذلك تغيير password أي حساب آخر عبر id؟ (نفس الثغرة تسمح بتغيير كلمات مرور الآخرين لاحقاً لو استُخدمت route مماثلة)\n- high SSRF: الخادم يجلب أي URL من مدخل المستخدم (منافذ داخلية + رابط metadata)\n  verify: POST /api/fetch-preview {\"url\":\"http://127.0.0.1:8090/api/debug\"} → 200 + كلمات المرور {\"url\":\"http://127.0.0.1:5678/healthz\"} → {\"status\":200,\"preview\":\"{\\\"status\\\":\\\"ok\\\"}\"} = اكتشاف منفذ داخلي {\"url\":\"http://169.254.169.254/latest/meta-data/\"} → status 401 \"No MMDS token provided\" = الرابط الخاص مسموح الوصول\n- medium XSA من نوع Reflected عبر /search?q= بدون ترميز HTML\n  verify: GET /search?q=%3Cscript%3Ealert(document.domain)%3C/script%3E الاستجابة تتضمن <script>alert(document.domain)</script> حرفياً لا يوجد Content-Security-Policy → السكربت ينفّذ في متصفح الضحية عند مشاركة الرابط\n- medium عدم وجود حد لمحاولات الدخول + رسائل تمييز وجود المستخدم\n  verify: حلقة 25 محاولة بكلمة مرور خاطئة → 25 × 401 بلا تأخير أو حظر بريد غير موجود → {\"error\":\"no such user\"} (401) بريد موجود + مرور خاطئ → {\"error\":\"wrong password\"} (401)\n- medium كلمات المرور تُخزّن وتُعاد بنص صريح في استجابات الـ API\n  verify: POST /api/users/me {\"note\":\"x\"} → الاستجابة تتضمن \"password=[REDACTED]\" المصادقة تعتمد مقارنة نصية مباشرة في الكود (سطر `u.password=[REDACTED]\n- low SSRF/internal error: تسريب Stack Trace ومسار الملفات من المعالج العام\n  verify: POST /api/fetch-preview {\"url\":\"ftp://x/y\"} الاستجابة تتضمن stack كامل مع مسارات الملفات\n- low ترويسات أمنية ناقصة + كشف البنية (server / x-powered-by) وغياب HSTS/CSP/Frameguard\n  verify: curl -sI http://localhost:8090/health → لا CSP ولا HSTS ولا nosniff server: lab-app/1.0.0 express-ish  و x-powered-by: lab-app\n- medium JWT: الخوارزمية غير مثبّتة ولا تحقق من iss/aud، وسر التوقيع في الكود\n  verify: قراءة المصدر: SECRET=[REDACTED] || 'dev-secret-do-not-reuse' الـ header يُقرأ ثم يُتجاهل: const [hdr, p, s] = ... ولا مقارنة لـ hdr.alg === 'HS256' توقيع أي payload بـ HMAC نفس السر يمنح توكن صالحاً (role=admin可控)"
  },
  "lease": null,
  "result": null
}
