{
  "schema": "arena.job/1",
  "id": "JOB-20260829-a52d70",
  "title": "smoke",
  "target": {
    "value": "http://localhost:8090",
    "kind": "url",
    "authorized": true
  },
  "actions": [
    "passive",
    "active"
  ],
  "mode": "quick",
  "priority": "P2",
  "state": "done",
  "created_at": "2026-08-29T19:33:02.958Z",
  "updated_at": "2026-08-29T19:33:13.362Z",
  "requested_by": "n8n",
  "notify_url": null,
  "context": {},
  "lease": null,
  "result": {
    "verdict": "FAIL",
    "score": 88,
    "summary": "فحص سريع: ثغرة وصول واحدة مؤكدة",
    "counts": {
      "total": 1,
      "by_severity": {
        "high": 1
      },
      "open": 1,
      "fixed_verified": 0,
      "blocking": 1
    },
    "report": "report.md",
    "finished_at": "2026-08-29T19:33:13.362Z"
  }
}
